{
  "$id": "https://scalario.io/schemas/v1.0.0/screen-config.schema.json",
  "$schema": "https://json-schema.org/draft/2020-12/schema",
  "title": "ScreenConfig",
  "description": "Configuration d'un écran BDUI. Définit le layout, les zones de contenu, et les composants à afficher. Chaque écran est identifié par son champ 'screen' et versionné via schema_version.",
  "type": "object",
  "properties": {
    "screen": {
      "type": "string",
      "description": "Identifiant unique de l'écran dans le module (ex: 'dashboard', 'order_list', 'product_detail').",
      "minLength": 1
    },
    "schema_version": {
      "const": "1.0.0",
      "description": "Version du schéma BDUI. Figé à '1.0.0' pour cette version du contrat. Permet au runtime de router vers le bon validateur."
    },
    "layout": {
      "enum": ["dashboard", "list", "form", "detail"],
      "description": "Type de layout de l'écran. dashboard = grille de KPIs + widgets ; list = tableau + filtres ; form = formulaire de saisie ; detail = vue détail avec aside."
    },
    "title": {
      "type": "string",
      "description": "Titre affiché de l'écran. Peut être une clé i18n si i18n_key est défini."
    },
    "i18n_key": {
      "type": "string",
      "description": "Clé i18n pour le titre de l'écran. Si défini, le titre affiché est la traduction de cette clé."
    },
    "templates": {
      "type": "object",
      "description": "Dictionnaire de templates locaux. Permet de définir des composants réutilisables (ex: product_card) pour réduire la taille du JSON.",
      "additionalProperties": {
        "$ref": "https://scalario.io/schemas/v1.0.0/component-config.schema.json"
      }
    },
    "zones": {
      "type": "object",
      "description": "Zones de l'écran. Chaque zone contient une liste de ComponentConfig. Un screen doit avoir au moins la zone 'main'.",
      "properties": {
        "kpis": {
          "type": "array",
          "description": "Zone KPIs — cartes d'indicateurs en haut de l'écran (layout dashboard).",
          "items": { "$ref": "https://scalario.io/schemas/v1.0.0/component-config.schema.json" }
        },
        "main": {
          "type": "array",
          "description": "Zone principale — contenu central de l'écran.",
          "items": { "$ref": "https://scalario.io/schemas/v1.0.0/component-config.schema.json" }
        },
        "aside": {
          "type": "array",
          "description": "Zone latérale — informations complémentaires, actions secondaires.",
          "items": { "$ref": "https://scalario.io/schemas/v1.0.0/component-config.schema.json" }
        },
        "actions": {
          "type": "array",
          "description": "Zone actions — boutons d'action, menus contextuels.",
          "items": { "$ref": "https://scalario.io/schemas/v1.0.0/component-config.schema.json" }
        }
      },
      "additionalProperties": false
    }
  },
  "required": ["screen", "schema_version", "layout", "zones"],
  "additionalProperties": false
}