{
  "screen": "daily_report",
  "schema_version": "1.0.0",
  "layout": "dashboard",
  "title": "Rapport du jour",
  "zones": {
    "kpis": [
      { "type": "KPICard", "variant": "default", "props": { "label": "CA", "value": "47 500", "unit": "FCFA" } },
      { "type": "KPICard", "variant": "default", "props": { "label": "Marge brute", "value": "14 200", "unit": "FCFA", "delta": "30%" } },
      { "type": "KPICard", "variant": "default", "props": { "label": "Pertes", "value": "2 500", "unit": "FCFA", "status": "warning" } },
      { "type": "KPICard", "variant": "default", "props": { "label": "Transactions", "value": "18" } }
    ],
    "main": [
      { "type": "ChartBar", "variant": "default", "props": { "title": "CA 7 derniers jours", "data": [ { "label": "Lun", "value": 32 }, { "label": "Mar", "value": 45 }, { "label": "Mer", "value": 38 }, { "label": "Jeu", "value": 55 }, { "label": "Ven", "value": 62 }, { "label": "Sam", "value": 47 }, { "label": "Dim", "value": 28 } ] } },
      { "type": "DataTable", "variant": "default", "props": { "title": "Top produits", "columns": [ { "key": "produit", "label": "Produit" }, { "key": "qte", "label": "Qté" }, { "key": "ca", "label": "CA" } ], "rows": [ { "produit": "Tomates", "qte": "12.5kg", "ca": "18 750 F" }, { "produit": "Bananes", "qte": "15kg", "ca": "7 500 F" }, { "produit": "Oignons", "qte": "10kg", "ca": "5 000 F" } ] } }
    ]
  }
}
