{
  "screen": "loss_list",
  "schema_version": "1.0.0",
  "layout": "list",
  "title": "Pertes déclarées",
  "zones": {
    "main": [
      { "type": "DataTable", "variant": "default", "props": { "columns": [ { "key": "product", "label": "Article" }, { "key": "qte", "label": "Qté" }, { "key": "cause", "label": "Cause" }, { "key": "date", "label": "Date" }, { "key": "status", "label": "Statut" } ], "rows": [] } }
    ],
    "actions": [
      { "type": "ActionButton", "variant": "floating", "props": { "label": "Déclarer une perte", "icon": "add" } }
    ]
  }
}
