{
  "screen": "inventory_count",
  "schema_version": "1.0.0",
  "layout": "form",
  "title": "Inventaire",
  "zones": {
    "main": [
      { "type": "FormSection", "variant": "default", "props": { "title": "Sélectionner le périmètre" }, "children": [
        { "type": "Dropdown", "variant": "default", "props": { "label": "Catégorie", "name": "category", "options": [ { "value": "all", "label": "Tout le stock" }, { "value": "legumes", "label": "Légumes" }, { "value": "fruits", "label": "Fruits" }, { "value": "tubercules", "label": "Tubercules" } ] } }
      ] },
      { "type": "DataTable", "variant": "compact", "props": { "title": "Saisie des quantités", "columns": [ { "key": "product", "label": "Article" }, { "key": "theoretical", "label": "Théorique" }, { "key": "actual", "label": "Réel" }, { "key": "ecart", "label": "Écart" } ], "rows": [ { "product": "Tomates", "theoretical": 2, "actual": null, "ecart": null }, { "product": "Bananes", "theoretical": 3, "actual": null, "ecart": null }, { "product": "Oignons", "theoretical": 25, "actual": null, "ecart": null }, { "product": "Pommes de terre", "theoretical": 50, "actual": null, "ecart": null } ] } }
    ],
    "actions": [
      { "type": "ActionButton", "variant": "primary", "props": { "label": "Valider l'inventaire", "full_width": true } }
    ]
  }
}
