{
  "screen": "inventory_count",
  "schema_version": "1.0.0",
  "layout": "form",
  "title": "Inventaire",
  "zones": {
    "main": [
      { "type": "DataTable", "variant": "compact", "props": { "columns": [ { "key": "product", "label": "Article" }, { "key": "theoretical", "label": "Théorique" }, { "key": "actual", "label": "Réel" } ], "rows": [] } }
    ],
    "actions": [
      { "type": "ActionButton", "variant": "primary", "props": { "label": "Valider", "full_width": true } }
    ]
  }
}
