{
  "screen": "stock_list",
  "schema_version": "1.0.0",
  "layout": "list",
  "title": "Stock",
  "zones": {
    "main": [
      { "type": "DataTable", "variant": "default", "props": { "columns": [ { "key": "name", "label": "Produit" }, { "key": "stock_quantity", "label": "Stock" }, { "key": "min_threshold", "label": "Seuil" }, { "key": "status", "label": "Statut" } ], "rows": [ { "name": "Tomates", "stock_quantity": 2, "min_threshold": 10, "status": "critique" }, { "name": "Bananes", "stock_quantity": 3, "min_threshold": 10, "status": "critique" }, { "name": "Oignons", "stock_quantity": 25, "min_threshold": 5, "status": "ok" }, { "name": "Pommes de terre", "stock_quantity": 50, "min_threshold": 10, "status": "ok" }, { "name": "Salades", "stock_quantity": 8, "min_threshold": 5, "status": "warning" } ] } }
    ],
    "actions": [
      { "type": "ActionButton", "variant": "floating", "props": { "label": "Inventaire", "icon": "fact_check" } }
    ]
  }
}
