{
  "screen": "sale_list",
  "schema_version": "1.0.0",
  "layout": "list",
  "title": "Ventes",
  "zones": {
    "main": [
      { "type": "DataTable", "variant": "default", "props": { "columns": [ { "key": "id", "label": "N°" }, { "key": "total", "label": "Total" }, { "key": "payment", "label": "Paiement" }, { "key": "created_at", "label": "Heure" }, { "key": "status", "label": "Statut" } ], "rows": [] } }
    ],
    "actions": [
      { "type": "ActionButton", "variant": "floating", "props": { "label": "Nouvelle vente", "icon": "add" } }
    ]
  }
}
