{
  "schema_version": "1.0.0",
  "screen": "simple_form",
  "layout": "form",
  "title": "Nouvelle vente",
  "i18n_key": "screen.simple_form.title",
  "zones": {
    "main": [
      {
        "type": "FormWidget",
        "id": "form_sale",
        "props": {
          "title": "Détails de la vente",
          "hint": "Renseignez les 4 champs ci-dessous."
        }
      }
    ],
    "actions": [
      {
        "type": "ActionButton",
        "id": "btn_submit",
        "props": {
          "icon_code_point": 57679,
          "label": "Enregistrer"
        }
      }
    ]
  }
}
