{
  "screen": "dashboard_owner",
  "schema_version": "1.0.0",
  "layout": "dashboard",
  "title": "Boutique Kouame",
  "zones": {
    "kpis": [
      { "type": "KPICard", "variant": "default", "props": { "label": "CA du jour", "value": "47 500", "unit": "FCFA", "delta": "+12%", "delta_positive": true } },
      { "type": "KPICard", "variant": "default", "props": { "label": "Marge brute", "value": "14 200", "unit": "FCFA", "delta": "30%", "delta_positive": true } },
      { "type": "KPICard", "variant": "default", "props": { "label": "Transactions", "value": "18", "delta": "+3 vs hier", "delta_positive": true } },
      { "type": "KPICard", "variant": "default", "props": { "label": "Stock critique", "value": "2", "unit": "articles", "status": "critical" } }
    ],
    "main": [
      { "type": "AlertBanner", "variant": "critical", "props": { "message": "2 articles en stock critique — Tomates 2kg, Bananes 3kg" }, "visible_if": { "operator": ">", "field": "critical_count", "value": 0 } },
      { "type": "ChartBar", "variant": "default", "props": { "title": "CA 7 derniers jours", "data": [ { "label": "Lun", "value": 32 }, { "label": "Mar", "value": 45 }, { "label": "Mer", "value": 38 }, { "label": "Jeu", "value": 55 }, { "label": "Ven", "value": 62 }, { "label": "Sam", "value": 47 }, { "label": "Dim", "value": 28 } ] } },
      { "type": "DataTable", "variant": "default", "props": { "title": "Dernières ventes", "columns": [ { "key": "produit", "label": "Produit" }, { "key": "qte", "label": "Qté" }, { "key": "prix", "label": "Prix" }, { "key": "heure", "label": "Heure" } ], "rows": [ { "produit": "Tomates 2,5kg", "qte": "1", "prix": "3 750 F", "heure": "08h33" }, { "produit": "Bananes 3kg", "qte": "1", "prix": "1 500 F", "heure": "08h12" }, { "produit": "Oignons 5kg", "qte": "1", "prix": "2 500 F", "heure": "07h45" } ] } },
      { "type": "SyncStatusBar", "variant": "default", "props": { "status": "synced" } }
    ],
    "actions": [
      { "type": "ActionButton", "variant": "primary", "props": { "label": "Rapports", "icon": "bar_chart" } },
      { "type": "ActionButton", "variant": "primary", "props": { "label": "Stock", "icon": "inventory_2" } },
      { "type": "ActionButton", "variant": "primary", "props": { "label": "Équipe", "icon": "people" } },
      { "type": "ActionButton", "variant": "primary", "props": { "label": "Commander", "icon": "local_shipping" } }
    ]
  }
}
