{
  "screen": "pos_commercial",
  "schema_version": "1.0.0",
  "layout": "dashboard",
  "title": "Caisse",
  "zones": {
    "kpis": [
      { "type": "KPICard", "variant": "hero", "props": { "label": "Solde caisse", "value": "142 500", "unit": "FCFA" } },
      { "type": "KPICard", "variant": "compact", "props": { "label": "Ventes aujourd'hui", "value": "12" } }
    ],
    "main": [
      { "type": "DataTable", "variant": "default", "props": { "title": "Ventes du jour", "columns": [ { "key": "produit", "label": "Produit" }, { "key": "qte", "label": "Qté" }, { "key": "prix", "label": "Prix" } ], "rows": [ { "produit": "Tomates", "qte": "2.5kg", "prix": "3 750 F" }, { "produit": "Bananes", "qte": "3kg", "prix": "1 500 F" }, { "produit": "Oignons", "qte": "5kg", "prix": "2 500 F" } ] } }
    ],
    "actions": [
      { "type": "ActionButton", "variant": "floating", "props": { "label": "Nouvelle vente", "icon": "add" } },
      { "type": "ActionButton", "variant": "secondary", "props": { "label": "Clôture caisse", "icon": "payments" } }
    ]
  }
}
