{
  "screen": "pos",
  "schema_version": "1.0.0",
  "layout": "dashboard",
  "title": "Point de vente",
  "zones": {
    "kpis": [
      { "type": "KPICard", "variant": "hero", "props": { "label": "Total panier", "value": "0", "unit": "FCFA" } },
      { "type": "KPICard", "variant": "compact", "props": { "label": "Articles", "value": "0" } }
    ],
    "main": [
      { "type": "DataTable", "variant": "compact", "props": { "title": "Panier", "columns": [ { "key": "product", "label": "Article" }, { "key": "qte", "label": "Qté" }, { "key": "prix", "label": "Prix" } ], "rows": [] } }
    ],
    "actions": [
      { "type": "ActionButton", "variant": "primary", "props": { "label": "Ajouter article", "icon": "add" } },
      { "type": "ActionButton", "variant": "primary", "props": { "label": "Paiement", "icon": "payments" } }
    ]
  }
}
