{
  "screen": "alert_detail",
  "schema_version": "1.0.0",
  "layout": "detail",
  "title": "Alerte stock",
  "zones": {
    "kpis": [
      { "type": "KPICard", "variant": "compact", "props": { "label": "Article", "value": "Tomates" } },
      { "type": "KPICard", "variant": "compact", "props": { "label": "Stock actuel", "value": "2 kg", "status": "critical" } },
      { "type": "KPICard", "variant": "compact", "props": { "label": "Seuil", "value": "10 kg" } }
    ],
    "main": [
      { "type": "AlertBanner", "variant": "critical", "props": { "message": "Le stock de Tomates est sous le seuil critique. Commandez ou réallouez depuis le stock livraison." } },
      { "type": "DataTable", "variant": "compact", "props": { "title": "Derniers mouvements", "columns": [ { "key": "date", "label": "Date" }, { "key": "type", "label": "Type" }, { "key": "qte", "label": "Qté" } ], "rows": [ { "date": "31/05", "type": "Vente", "qte": "-2.5 kg" }, { "date": "30/05", "type": "Livraison", "qte": "+20 kg" }, { "date": "29/05", "type": "Perte", "qte": "-1 kg" } ] } }
    ],
    "actions": [
      { "type": "ActionButton", "variant": "primary", "props": { "label": "Notifier le manager", "icon": "notifications" } },
      { "type": "ActionButton", "variant": "secondary", "props": { "label": "Voir historique", "icon": "history" } },
      { "type": "ActionButton", "variant": "secondary", "props": { "label": "Commander", "icon": "local_shipping" } }
    ]
  }
}
